{
  "episode_id": "EP001",
  "titles": {
    "suspense": "一口从未干过的井，为什么突然空了？",
    "cognitive": "每个人只多拿一点，最后所有人都没水",
    "real_world": "为什么大家都做了合理选择，结果却更糟？"
  },
  "cover_options": [
    {
      "text": "谁弄干了这口井？",
      "visual": "干裂井底居中，阿远的空桶在前景，围观人群只保留剪影。",
      "safe_area": "文字置中上方，避开顶部状态栏和底部平台按钮。"
    },
    {
      "text": "每个人只多拿一点",
      "visual": "井边排满大桶，井水水位很低，人物表情不做脸谱化。",
      "safe_area": "文字置左上，人物和井口位于中部。"
    }
  ],
  "voiceover": "雾谷有一口从没见过井底的水井。可有一天，全村人却守着它渴了一整天。井在村子中央，谁都可以取水。过去，大家只装当天够喝的量。夜里，地下水慢慢补回来，第二天又刚好够用。一个清晨，阿远发现邻居多带了一只桶。他想到家里还有老人，万一明天来晚了呢？于是，他也多打了一桶。第二天，更多人带来了大桶。有人说，自己不多拿，水也会被别人拿走。井水越来越浅，排队却越来越早。每个人只多拿一点，谁都觉得问题不在自己。直到一个清晨，木桶落下去，只传来撞击井底的空响。你觉得，究竟是谁弄干了这口井？没有一个人单独毁掉它。这个故事讲的，是公地悲剧。水井是共享资源。多打一桶的好处归自己，水位下降的代价却由全村分担。当每个人都做同样合理的选择，资源就会被共同耗尽。所以下次看到人人都想多拿一点时，别只问谁自私，也要问规则把代价留给了谁。",
  "guess_question": "在概念揭晓前，你觉得是谁弄干了这口井？",
  "pinned_comment": "现实里，哪些公共资源最容易出现“我少拿也没用”的心理？规则应该怎样让收益和代价重新对应？",
  "post_copy": "先别急着找坏人。很多共同损失，来自每个人都做了一个对自己合理的选择。听到最后，再看看你能不能猜出这个概念。",
  "hashtags": [
    "#故事里的知识",
    "#寓言",
    "#公地悲剧",
    "#认知",
    "#FableFlow"
  ],
  "ai_disclosure": "本视频脚本与画面含 AI 辅助生成，内容经人工审核。",
  "experiment_hypothesis": {
    "variable": "结果前置的干井钩子",
    "prediction": "比从正常取水开始更能提升前 3 秒留存，同时不降低最终揭晓体验。",
    "success_signal": "同批视频中 3 秒留存较高，且评论仍有有效猜测而非开头直接猜中。"
  }
}
